{
  "ai_factory_build_id": "nova-default",
  "built_at": "2026-06-07T19:55:59+00:00",
  "bundle_root": "E:/project-infi/wolf-cog-os/artifacts/synthetic-mind-bundle",
  "bundle_sha256": "a272938cdf3ab378394ba95ee461ba980a851c610f2c4436bc612ccbd8142005",
  "bundle_version": "synthetic_mind_bundle.v1",
  "claim_posture": "asserted",
  "family_id": "nova.cortex",
  "family_version": "3.0",
  "files": [
    {
      "relative_path": "opt/cogos/config/cognitive_runtime_family.json",
      "sha256": "84868bee665e9bdd024a52e33a401230d23d79b23baed540de3b863b28fd6401"
    },
    {
      "relative_path": "opt/cogos/runtime/src/__init__.py",
      "sha256": "e3b0c44298fc1c149afbf4c8996fb92427ae41e4649b934ca495991b7852b855"
    },
    {
      "relative_path": "opt/cogos/runtime/src/aais_composed_runtime.py",
      "sha256": "8c3bb86503bfd4543b9ae354e85df8f461be49e3f2ba9498e6be9db4eb005319"
    },
    {
      "relative_path": "opt/cogos/runtime/src/aais_ul.py",
      "sha256": "94ad139403577bb89dfa5b57a2b97ef3ca9e3f978c75a9edbd3028bba0940898"
    },
    {
      "relative_path": "opt/cogos/runtime/src/aais_ul_substrate.py",
      "sha256": "49b6a119cb5aeda7d6bc6afc9c89568887406a4b9d9bc203a9f90c8c3a71387e"
    },
    {
      "relative_path": "opt/cogos/runtime/src/cog_runtime/__init__.py",
      "sha256": "639dd3c75e0f65c93ccd9309cf5daa82c2d07eeaf05c69ffd73c82b4a42e3d48"
    },
    {
      "relative_path": "opt/cogos/runtime/src/cog_runtime/arcs.py",
      "sha256": "6576dd3ebb6ae3a6b6d7238b36b63ee5ee9bc56f48410ea430a1850f757408b6"
    },
    {
      "relative_path": "opt/cogos/runtime/src/cog_runtime/attention.py",
      "sha256": "f9e6090aeedc664f762b146a0ad3a65ee2a3934f6a6746fc52f659aa2e83a834"
    },
    {
      "relative_path": "opt/cogos/runtime/src/cog_runtime/base.py",
      "sha256": "25b30a97f6de2e7fa8d617d9ba2ed850b9a2a2c64bba3e997f91b4d11ab8e058"
    },
    {
      "relative_path": "opt/cogos/runtime/src/cog_runtime/capability_governance.py",
      "sha256": "aaeafca75c7fff875821aaea820763a42e341f4e2fa244fbdf571ef404f40496"
    },
    {
      "relative_path": "opt/cogos/runtime/src/cog_runtime/coherence_projection.py",
      "sha256": "1be5a79064f187a4d75ff6f59fe2241590df6d0f7c7e3a3106a02731a4821344"
    },
    {
      "relative_path": "opt/cogos/runtime/src/cog_runtime/deliberation.py",
      "sha256": "d26630286386e825f9b533e7dfaad126a23e48aca96b86cb68dd6ba8a8a98275"
    },
    {
      "relative_path": "opt/cogos/runtime/src/cog_runtime/deliberation_llm.py",
      "sha256": "99d77970c5131ea1bd0e142eaaaed6efba5191b42fb28883b38b3e4d8f16e8cd"
    },
    {
      "relative_path": "opt/cogos/runtime/src/cog_runtime/execution.py",
      "sha256": "674ad942c5e26fef43e79a2e5587c9044c6566808a416508821b842e51d1105d"
    },
    {
      "relative_path": "opt/cogos/runtime/src/cog_runtime/formal/__init__.py",
      "sha256": "8b96f3cbb208450ba3531e38e3db9b3704ebee56004260aa7cf5faa29707b70d"
    },
    {
      "relative_path": "opt/cogos/runtime/src/cog_runtime/formal/activation_predicates.py",
      "sha256": "565c4233ac55f1ce83581c74637121368515256c831a3826aaa23cda5144ff1c"
    },
    {
      "relative_path": "opt/cogos/runtime/src/cog_runtime/formal/agency_preservation.py",
      "sha256": "701cc766988dcef7dbb97ec7f6239c26774446a3add30552135ba42e6923ccd0"
    },
    {
      "relative_path": "opt/cogos/runtime/src/cog_runtime/formal/consentful_inference.py",
      "sha256": "23afa5735561f78f5012e4e3012102ec2dcc7561310fa78756a0b6d5c4488401"
    },
    {
      "relative_path": "opt/cogos/runtime/src/cog_runtime/formal/distributed_ledger.py",
      "sha256": "1d2fa869f61e0078dbe7d1421d548a338c37e1d36df66440cb96e7cc7c14ed39"
    },
    {
      "relative_path": "opt/cogos/runtime/src/cog_runtime/formal/generation_gate.py",
      "sha256": "48fc26212b1be37d48309d29b2ee992831e7afc948a9a7094bf04ba43bc3dadb"
    },
    {
      "relative_path": "opt/cogos/runtime/src/cog_runtime/formal/intent_narrative_reconcile.py",
      "sha256": "da1f5bd605bc3d85e4021d75d3ccb16811101e6100aff62154262fe9f6ed336c"
    },
    {
      "relative_path": "opt/cogos/runtime/src/cog_runtime/formal/ledger_schema.py",
      "sha256": "ac9391b8fdde5c524bb535cd0b543a41f2c1317776e4a6ff687d36ad113f5884"
    },
    {
      "relative_path": "opt/cogos/runtime/src/cog_runtime/formal/output_constraints.py",
      "sha256": "d954a4845390e72210076233977de951f67c5b0cffa478b97f6f1e43734dcf91"
    },
    {
      "relative_path": "opt/cogos/runtime/src/cog_runtime/formal/output_type_governance.py",
      "sha256": "e8e321cd44a435a8b277603b1eed8d674fcfde5e152450303c5473adffc57826"
    },
    {
      "relative_path": "opt/cogos/runtime/src/cog_runtime/formal/spine_pipeline.py",
      "sha256": "4f667981028e844aab127c1ec6a5fee5cf64e018ef663f902302d7ba6543fe72"
    },
    {
      "relative_path": "opt/cogos/runtime/src/cog_runtime/formal/turn_agency.py",
      "sha256": "0b950311dd50e4e590e98a3f66e7f56d2e6572cf87b57ed5d55b6b94c60697f1"
    },
    {
      "relative_path": "opt/cogos/runtime/src/cog_runtime/intent_agency_evidence.py",
      "sha256": "a4bc03f2cb32b92b4e2cbd21ca5accc5cfafb948a8e8c01e0506a2506a6bfbe0"
    },
    {
      "relative_path": "opt/cogos/runtime/src/cog_runtime/intent_consult.py",
      "sha256": "46f33a6ad91d5db43cf49fb900c04759a5f53cec247eb9c325ef9e3d3ba1606e"
    },
    {
      "relative_path": "opt/cogos/runtime/src/cog_runtime/intent_core.py",
      "sha256": "b05d3120da8e97995f5422028aad0220808dce691f5773824e16dbc3746416ff"
    },
    {
      "relative_path": "opt/cogos/runtime/src/cog_runtime/intent_store.py",
      "sha256": "bb4c557efb16ac758b77d54481454b11e8518457f15b259c19758337238e29ba"
    },
    {
      "relative_path": "opt/cogos/runtime/src/cog_runtime/memory.py",
      "sha256": "a00fa4070bb2d148bf5ff3331188221dbf6bd4d5ea4563b73586818ea29906b3"
    },
    {
      "relative_path": "opt/cogos/runtime/src/cog_runtime/narrative.py",
      "sha256": "1449aa4774ed274d2e6ece3d5a3a1c2c4fa2b710fd7efbded1a3ea335ff8fe4b"
    },
    {
      "relative_path": "opt/cogos/runtime/src/cog_runtime/narrative_continuity.py",
      "sha256": "f4a730429854dbc1f9ca03ff7898e076c7bed74d18a52a4b45289b55e6e6521c"
    },
    {
      "relative_path": "opt/cogos/runtime/src/cog_runtime/narrative_continuity_evidence.py",
      "sha256": "5dd44ec47f1c4b1721f22f53885984d28460fc46ba7dc6eb65c95ed3228ed035"
    },
    {
      "relative_path": "opt/cogos/runtime/src/cog_runtime/narrative_continuity_operator_rubric.py",
      "sha256": "da6b3bf67af0692eeba8fb5dda74408b455393e1b35cf30828caab352cdf2435"
    },
    {
      "relative_path": "opt/cogos/runtime/src/cog_runtime/narrative_store.py",
      "sha256": "8ca5a552339dbda49f3434817bef684a45b5942deac10de4c7ae05cbe4a822a0"
    },
    {
      "relative_path": "opt/cogos/runtime/src/cog_runtime/nova.py",
      "sha256": "1e3708e623a33814f249b132779bcacc7c424bae62cf51c1864863e6f8d68c83"
    },
    {
      "relative_path": "opt/cogos/runtime/src/cog_runtime/nova_face.py",
      "sha256": "d13d98817bf572e1095207a96d5adc648c91f70e1f73551d6cd0ce2cf3441ee4"
    },
    {
      "relative_path": "opt/cogos/runtime/src/cog_runtime/planning.py",
      "sha256": "11aa263e52c378f0e337d3b893713f5363771a2d77e9c48087f47392dbe370e2"
    },
    {
      "relative_path": "opt/cogos/runtime/src/cog_runtime/reflection.py",
      "sha256": "b8bef76fc8ae8e48b8996207c129703d48b3d2a87a9277ac23d074d37dcd1571"
    },
    {
      "relative_path": "opt/cogos/runtime/src/cog_runtime/spark_pipeline.py",
      "sha256": "cad2bc1d9032becc6f09344836931f58365fefd7afa33b361ecddd65f88e52cc"
    },
    {
      "relative_path": "opt/cogos/runtime/src/cog_runtime/tuning.py",
      "sha256": "4c999789ed38c52116b1185627b03f087dfcfc538e963528c432ba9035220337"
    },
    {
      "relative_path": "opt/cogos/runtime/src/cog_runtime/wolf_rehydration_harness.py",
      "sha256": "1a20f3c167911ab2ab603f7d7675cc2b10313851d88186b37be57d84e67a1d3a"
    },
    {
      "relative_path": "opt/cogos/runtime/src/cogos_runtime_bridge.py",
      "sha256": "b7a2bb4c74ca0bef975c7424603a2c02602ef0ac209859103a9b5fa822e1fd02"
    },
    {
      "relative_path": "opt/cogos/runtime/src/direct_challenge_module.py",
      "sha256": "3bf0e317fec12a831bc6575ea63e95d222b61341243cea769caa9c2191898f4b"
    },
    {
      "relative_path": "opt/cogos/runtime/src/jarvis_reasoning_protocol.py",
      "sha256": "1d2bd87e81a9a6b2b431f45dba5be27a920a6f2f8f4448010a48031f5019250a"
    },
    {
      "relative_path": "opt/cogos/runtime/src/jarvis_types.py",
      "sha256": "b22fff1f96a1c3cc972c93d75ceabe9a8cf3874b3869ebfb4ba6d70595331a49"
    },
    {
      "relative_path": "opt/cogos/runtime/src/reasoning_types.py",
      "sha256": "f28be22532fb60329ea1353b37fb3288a2136b8dc79059016e5330feec96f5e7"
    },
    {
      "relative_path": "opt/cogos/runtime/src/speaking_runtime/__init__.py",
      "sha256": "8ac60b13465cff35351b57edcae75ea1304e0831a7a6b225926c55230ebcc6a1"
    },
    {
      "relative_path": "opt/cogos/runtime/src/speaking_runtime/__main__.py",
      "sha256": "027ab529f01654a0e3e79fc33d98dc1289417e72080b7a95b87a858ef96114b5"
    },
    {
      "relative_path": "opt/cogos/runtime/src/speaking_runtime/integration.py",
      "sha256": "a0a0a19b733fe9537e202910212532ef001f4cad8a155baf6211aa7f3f18ef78"
    }
  ],
  "required_modules": [
    "cog_runtime/coherence_projection.py",
    "cog_runtime/spark_pipeline.py",
    "cog_runtime/formal/spine_pipeline.py"
  ],
  "spark_pipeline_id": "nova.spark.v1"
}
